{
  "schemaVersion": "1.0.0",
  "kind": "visual-diff-report",
  "pageId": "b-identical",
  "stateId": "default",
  "generatedAt": "2026-10-28T13:53:16.740Z",
  "prototype": {
    "platform": "web",
    "url": "file:///D:/OurTrail/prototype-fidelity-suite/examples/generic-web/b/base.html",
    "viewport": {
      "width": 390,
      "height": 844
    },
    "dpr": 1,
    "codeVersion": "4922e151581e9ffbf8ee338cebe3fd47444c19a2",
    "dataSource": "real",
    "capturedAt": "2026-10-28T13:53:10.592Z",
    "screenshotSha256": "aa388c693ef44064532c4d448fc65e1a7471833fc3a51f3082338b1d90e20667",
    "screenshotScale": {
      "x": 1,
      "y": 1
    },
    "note": null
  },
  "target": {
    "platform": "web",
    "url": "file:///D:/OurTrail/prototype-fidelity-suite/examples/generic-web/b/base.html",
    "viewport": {
      "width": 390,
      "height": 844
    },
    "dpr": 1,
    "codeVersion": "4922e151581e9ffbf8ee338cebe3fd47444c19a2",
    "dataSource": "real",
    "capturedAt": "2026-10-28T13:53:16.438Z",
    "screenshotSha256": "aa388c693ef44064532c4d448fc65e1a7471833fc3a51f3082338b1d90e20667",
    "screenshotScale": {
      "x": 1,
      "y": 1
    },
    "note": null
  },
  "tolerances": {
    "position": 1.5,
    "size": 1.5,
    "gap": 1,
    "font": 1,
    "color": 6,
    "pixelRatio": 0.02,
    "criticalPixelRatio": 0.005
  },
  "measurement": {
    "method": "region-crop",
    "note": "Both sides are cropped to the shared CSS sub-rect of the two nodes (common width and height, each anchored at its own origin), so a component offset is not charged to every region and a size difference stays a geometry finding.",
    "regionsCompared": 8,
    "regionsFailing": 0,
    "totalDiffRatio": 0
  },
  "regions": [
    {
      "id": "b-title",
      "role": "标题",
      "criticality": "critical",
      "status": "PASS",
      "categories": [],
      "observedCategories": [],
      "notes": null,
      "presence": {
        "prototype": true,
        "target": true
      },
      "geometry": {
        "dx": 0,
        "dy": 0,
        "dw": 0,
        "dh": 0,
        "dwRatio": 1,
        "dhRatio": 1,
        "prototype": {
          "x": 16,
          "y": 24,
          "w": 358,
          "h": 28
        },
        "target": {
          "x": 16,
          "y": 24,
          "w": 358,
          "h": 28
        },
        "tolerances": {
          "position": 1.5,
          "size": 1.5
        },
        "positionPass": true,
        "sizePass": true
      },
      "note": null,
      "pixelCompared": true,
      "pixelMode": "informational",
      "styles": [
        {
          "prop": "font-size",
          "status": "PASS",
          "a": 20,
          "b": 20,
          "delta": 0
        },
        {
          "prop": "font-weight",
          "status": "PASS",
          "a": 600,
          "b": 600,
          "delta": 0
        },
        {
          "prop": "line-height",
          "status": "PASS",
          "a": 28,
          "b": 28,
          "delta": 0
        },
        {
          "prop": "letter-spacing",
          "status": "PASS",
          "a": 0,
          "b": 0,
          "delta": 0
        },
        {
          "prop": "text-align",
          "status": "PASS",
          "a": "start",
          "b": "start"
        },
        {
          "prop": "color",
          "status": "PASS",
          "a": "rgb(31, 42, 38)",
          "b": "rgb(31, 42, 38)",
          "delta": 0
        },
        {
          "prop": "background-color",
          "status": "PASS",
          "a": "rgba(0, 0, 0, 0)",
          "b": "rgba(0, 0, 0, 0)",
          "delta": 0
        },
        {
          "prop": "border-radius",
          "status": "PASS",
          "a": 0,
          "b": 0,
          "delta": 0
        },
        {
          "prop": "border-top-width",
          "status": "PASS",
          "a": 0,
          "b": 0,
          "delta": 0
        },
        {
          "prop": "border-top-color",
          "status": "PASS",
          "a": "rgb(31, 42, 38)",
          "b": "rgb(31, 42, 38)",
          "delta": 0
        },
        {
          "prop": "box-shadow",
          "status": "PASS",
          "a": "none",
          "b": "none"
        },
        {
          "prop": "opacity",
          "status": "PASS",
          "a": 1,
          "b": 1,
          "delta": 0
        },
        {
          "prop": "padding",
          "status": "PASS",
          "a": [
            0,
            0,
            0,
            0
          ],
          "b": [
            0,
            0,
            0,
            0
          ],
          "delta": 0
        },
        {
          "prop": "margin",
          "status": "PASS",
          "a": [
            0,
            0,
            0,
            0
          ],
          "b": [
            0,
            0,
            0,
            0
          ],
          "delta": 0
        },
        {
          "prop": "gap",
          "status": "PASS",
          "a": "normal",
          "b": "normal"
        },
        {
          "prop": "display",
          "status": "PASS",
          "a": "block",
          "b": "block"
        },
        {
          "prop": "flex-direction",
          "status": "PASS",
          "a": "row",
          "b": "row"
        },
        {
          "prop": "align-items",
          "status": "PASS",
          "a": "normal",
          "b": "normal"
        },
        {
          "prop": "justify-content",
          "status": "PASS",
          "a": "normal",
          "b": "normal"
        },
        {
          "prop": "overflow",
          "status": "PASS",
          "a": "visible",
          "b": "visible"
        },
        {
          "prop": "position",
          "status": "PASS",
          "a": "static",
          "b": "static"
        },
        {
          "prop": "text-transform",
          "status": "PASS",
          "a": "none",
          "b": "none"
        },
        {
          "prop": "white-space",
          "status": "PASS",
          "a": "normal",
          "b": "normal"
        }
      ],
      "text": {
        "prototype": "登山计划",
        "target": "登山计划",
        "equal": true,
        "judged": true,
        "comparable": true,
        "lines": {
          "prototype": 1,
          "target": 1
        },
        "lineDelta": 0
      },
      "pixel": {
        "status": "PASS",
        "diffCount": 0,
        "aaCount": 0,
        "diffRatio": 0,
        "meanDelta": 0,
        "maxDelta": 0,
        "components": [],
        "resampled": false,
        "prototypePixels": {
          "x": 16,
          "y": 24,
          "w": 358,
          "h": 28
        },
        "targetPixels": {
          "x": 16,
          "y": 24,
          "w": 358,
          "h": 28
        },
        "masked": null,
        "maskedBy": [],
        "informativeOnly": true,
        "ink": {
          "status": "PASS",
          "ratio": 1
        },
        "judged": true
      },
      "evidence": {
        "prototypeSelector": "#b-title",
        "targetSelector": "#b-title",
        "prototypePath": "div#device>div#sheet>h1#b-title",
        "targetPath": "div#device>div#sheet>h1#b-title"
      },
      "acceptedDifference": null,
      "acceptedCategories": [],
      "images": {
        "prototype": "D:\\OurTrail\\prototype-fidelity-suite\\examples\\generic-web\\reports\\exp-b-identical\\regions\\b-title-prototype.png",
        "target": "D:\\OurTrail\\prototype-fidelity-suite\\examples\\generic-web\\reports\\exp-b-identical\\regions\\b-title-target.png",
        "diff": "D:\\OurTrail\\prototype-fidelity-suite\\examples\\generic-web\\reports\\exp-b-identical\\regions\\b-title-diff.png"
      }
    },
    {
      "id": "b-card",
      "role": "卡片",
      "criticality": "critical",
      "status": "PASS",
      "categories": [],
      "observedCategories": [],
      "notes": null,
      "presence": {
        "prototype": true,
        "target": true
      },
      "geometry": {
        "dx": 0,
        "dy": 0,
        "dw": 0,
        "dh": 0,
        "dwRatio": 1,
        "dhRatio": 1,
        "prototype": {
          "x": 16,
          "y": 68,
          "w": 358,
          "h": 110
        },
        "target": {
          "x": 16,
          "y": 68,
          "w": 358,
          "h": 110
        },
        "tolerances": {
          "position": 1.5,
          "size": 1.5
        },
        "positionPass": true,
        "sizePass": true
      },
      "note": null,
      "pixelCompared": true,
      "pixelMode": "exact",
      "styles": [
        {
          "prop": "font-size",
          "status": "PASS",
          "a": 16,
          "b": 16,
          "delta": 0
        },
        {
          "prop": "font-weight",
          "status": "PASS",
          "a": 400,
          "b": 400,
          "delta": 0
        },
        {
          "prop": "line-height",
          "status": "PASS",
          "a": "normal",
          "b": "normal"
        },
        {
          "prop": "letter-spacing",
          "status": "PASS",
          "a": 0,
          "b": 0,
          "delta": 0
        },
        {
          "prop": "text-align",
          "status": "PASS",
          "a": "start",
          "b": "start"
        },
        {
          "prop": "color",
          "status": "PASS",
          "a": "rgb(31, 42, 38)",
          "b": "rgb(31, 42, 38)",
          "delta": 0
        },
        {
          "prop": "background-color",
          "status": "PASS",
          "a": "rgb(255, 255, 255)",
          "b": "rgb(255, 255, 255)",
          "delta": 0
        },
        {
          "prop": "border-radius",
          "status": "PASS",
          "a": 8,
          "b": 8,
          "delta": 0
        },
        {
          "prop": "border-top-width",
          "status": "PASS",
          "a": 1,
          "b": 1,
          "delta": 0
        },
        {
          "prop": "border-top-color",
          "status": "PASS",
          "a": "rgb(216, 216, 216)",